{
  "schema": "chi-bench/submission/v1",
  "submission": {
    "id": "erius",
    "team": "Michael Johnson (MJ)",
    "contact": "johnson.michael@gmail.com",
    "agent": "erius",
    "model": "anthropic/claude-opus-4-8",
    "notes": "Erius: a Governed Autotelic Multi-agent Product Organization (GAMPO) operating\nprocedure layered on Opus 4.8, run via the Claude Max subscription (CLI auth,\nno ANTHROPIC_API_KEY). Judge pinned to claude-opus-4-7 per leaderboard policy.\n",
    "submitted_at": "2026-06-05T09:13:20Z"
  },
  "dataset": {
    "version": "chi-bench-v1.0.0",
    "domains": [
      "pa_provider",
      "pa_um",
      "cm"
    ],
    "name": "chi-bench"
  },
  "results": {
    "overall": {
      "n_trials": 75,
      "n_tasks": 75,
      "pass_at_1": 0.37333333333333335,
      "mean_cost_usd": 0.0,
      "mean_walltime_s": 0.0
    },
    "per_domain": {
      "pa_provider": {
        "n_trials": 25,
        "n_tasks": 25,
        "pass_at_1": 0.4,
        "mean_cost_usd": 0.0,
        "mean_walltime_s": 0.0
      },
      "pa_um": {
        "n_trials": 25,
        "n_tasks": 25,
        "pass_at_1": 0.16,
        "mean_cost_usd": 0.0,
        "mean_walltime_s": 0.0
      },
      "cm": {
        "n_trials": 25,
        "n_tasks": 25,
        "pass_at_1": 0.56,
        "mean_cost_usd": 0.0,
        "mean_walltime_s": 0.0
      }
    },
    "mean_cost_usd": 0.0,
    "mean_walltime_s": 0.0
  },
  "provenance": {
    "chi_bench_git_sha": null,
    "image_digest": null,
    "judge_model": "claude-opus-4-7",
    "harness_version": "0.1.0"
  }
}